{
  "schema_version": "2.0",
  "request_id": "demo_run_01",
  "stream": "toxicity",
  "results": [
    {
      "compound_id": "candidate_001",
      "structure_id": "example_structure_v1",
      "status": "not_run",
      "assessment": {
        "endpoint_id": "human_dili_binary_v1",
        "positive_definition": "Most or Less DILI concern",
        "negative_definition": "No DILI concern",
        "context": {
          "species": "human",
          "system": "drug_level_annotation",
          "conditions": null
        },
        "evidence_type": "model_prediction",
        "risk_score": null,
        "score_kind": "unavailable",
        "direction": "higher_is_more_toxic",
        "threshold": null,
        "call": "unavailable",
        "calibration": {
          "status": "not_assessed",
          "reference": null
        },
        "uncertainty": {
          "method": "not_implemented",
          "value": null
        },
        "applicability": {
          "method": "nearest_train_tanimoto",
          "value": null
        }
      },
      "structural_evidence": {
        "canonical_smiles": "CCO",
        "atom_mapped_smiles": "[CH3:1][CH2:2][OH:3]",
        "standardization_version": "example_policy_v1",
        "attribution_status": "unavailable",
        "attribution_method": null,
        "attribution_target": null,
        "attribution_scale": null,
        "attribution_reference": null,
        "fragments": [],
        "structure_artifacts": [],
        "interactions": [],
        "mechanism_hypotheses": []
      },
      "supplementary_metrics": [],
      "provenance": {
        "method_id": "toxoracle_dili_v1",
        "model_origin": "unknown",
        "data_version": null,
        "training_membership": "unknown",
        "evidence_refs": []
      },
      "warnings": [
        "Interface fixture only; Team B has not reviewed this fixture and DILI inference has not run."
      ],
      "error": null
    }
  ]
}
